<?xml version="1.0" encoding="UTF-8"?>
<xs:schema xmlns:xs="http://www.w3.org/2001/XMLSchema">

    <xs:element name="productos">
        <xs:complexType>
            <xs:sequence>
                <xs:element name="producto" maxOccurs="unbounded">
                    <xs:complexType>
                        <xs:sequence>
                            <xs:element name="id"          type="xs:integer"/>
                            <xs:element name="foto"        type="xs:string"/>
                            <xs:element name="nombre"      type="xs:string"/>
                            <xs:element name="descripcion" type="xs:string"/>
                            <xs:element name="categoria"   type="xs:string"/>
                            <xs:element name="nivel"       type="xs:string"   minOccurs="0"/>
                            <xs:element name="duracion"    type="xs:string"   minOccurs="0"/>
                            <xs:element name="precio"      type="xs:decimal"  minOccurs="0"/>
                        </xs:sequence>
                    </xs:complexType>
                </xs:element>
            </xs:sequence>
        </xs:complexType>
    </xs:element>

</xs:schema>
